{
  "version": "1.0",
  "generated": "2026-03-04T22:00:00Z",
  "generator": "claude-opus-4-6",
  "spread_range": "spread_034-spread_041",
  "spreads": [
    {
      "spread_id": "spread_034",
      "movement": "movement_1_environment",
      "theme": "The Interface layer: the screen that watches back",
      "text_options": [
        {
          "option_id": "a",
          "label": "The five-word inversion",
          "display_text": "The screen watches back.",
          "body_text": null,
          "caption_text": null,
          "quotations_used": [],
          "voice_register": "declarative",
          "rhetorical_strategy": "assertion",
          "rationale": "Four words. Period. Nothing else on the spread. The content plan calls for restraint after the text-heavy spreads of the Stack's middle layers, and this delivers maximum rhetorical force through absolute economy. The sentence inverts the entire history of screen-based media: from window to eye. The reader encounters it surrounded by images of screens facing outward, and the blunt declarative voice makes the inversion feel not like argument but like weather report -- something already true, merely stated. No quotation, no attribution, no scholarly apparatus. The book's own voice, alone.",
          "word_count": 4
        },
        {
          "option_id": "b",
          "label": "The inventory of eyes",
          "display_text": "The screen watches back.",
          "body_text": null,
          "caption_text": "Your laptop camera was activated 47 times today by applications you did not open. Your phone's eye-tracking engine adjusted three headlines based on where you lingered. Your smart TV logged 6 hours of ambient audio. Your car's cabin camera measured your pupil dilation at a billboard.\n\nNone of this required your permission. All of it required your attention.",
          "quotations_used": [],
          "voice_register": "clinical",
          "rhetorical_strategy": "accumulation",
          "rationale": "The display text remains the same stark sentence, but the caption accumulates specific surveillance acts in a clinical register that reads like a device activity log. The numbers are precise enough to feel real, general enough to be representative. The shift from factual inventory to the closing two-sentence punch ('None of this required your permission. All of it required your attention.') pivots from clinical to confrontational without changing pitch. The form enacts the Interface layer's logic: data collection that looks like description.",
          "word_count": 75
        },
        {
          "option_id": "c",
          "label": "Kittler's ghost in the interface",
          "display_text": "The screen watches back.",
          "body_text": "The Interface layer is where computation meets the sensorium. In 1992, Kittler warned that graphical user interfaces hide the machine from its users. In 2026, the interface does not hide. It observes. Every surface is bidirectional. The screen is a membrane, not a window -- permeable in both directions, transmitting light outward and data inward simultaneously.\n\nBratton calls this the reciprocal surface. You call it your phone.",
          "caption_text": null,
          "quotations_used": [
            {
              "text": "Perfect graphic user interfaces, since they dispense with writing itself, hide a whole machine from its users.",
              "attribution": "Friedrich Kittler",
              "source": "There Is No Software, 1992"
            }
          ],
          "voice_register": "confrontational",
          "rhetorical_strategy": "confrontation",
          "rationale": "Places the display text within a theoretical lineage: Kittler's 1992 warning about the GUI as ideological screen, updated to 2026 where the interface has reversed from concealment to surveillance. The prose moves from historical reference to the present-tense punch of 'You call it your phone.' The confrontational register escalates through the paragraph -- starting in scholarly description, ending in direct address. Kittler and Bratton provide intellectual weight while the final line collapses the theory into the reader's pocket.",
          "word_count": 85
        }
      ],
      "design_specs": [
        {
          "spec_id": "1",
          "label": "Panoptic screen-wall",
          "layout": {
            "type": "image_dominant",
            "description": "Full-bleed collage of screens at every scale -- phone, laptop, tablet, smartwatch, billboard, dashboard, refrigerator display, ATM, security camera monitor -- all facing outward toward the reader. The screens fill both pages. Display text centered across the gutter in reversed-out type, floating in the middle of the screen-field. The reader is surrounded.",
            "left_page": "Left half of continuous screen collage. Screens of varying sizes, all oriented to face the reader. Each screen shows a subtle camera indicator or recording light -- a small red dot, a green LED, a camera icon.",
            "right_page": "Right half of screen collage. Display text reversed out of the image, centered horizontally across the gutter. If caption text is used, set very small (6pt) in bottom-right, barely legible against the screens.",
            "gutter_treatment": "continuous",
            "orientation": "landscape"
          },
          "typography": {
            "display_face": "Helvetica Neue Bold or Akzidenz-Grotesk Medium -- clean, authoritative, no ornamentation",
            "body_face": "Akkurat Mono for any caption text -- clinical, surveillance-register",
            "display_scale": "headline",
            "color_treatment": "reversed",
            "special_treatment": "Display text reversed white out of the dark screen-field. The text should feel like it is being projected FROM the screens, not printed on the page. If using option b, the caption text is set in monospaced type at caption scale, evoking a system log."
          },
          "image_direction": {
            "approach": "combination",
            "subject": "Composite image: dozens of screens at every scale, all facing the reader. Phones, laptops, monitors, smartwatches, digital billboards, car dashboards, smart refrigerators, security camera feeds, ATM screens. Each has a visible camera lens or recording indicator. The screens should vary in size, angle, and distance, creating a dimensional field -- some close, some far, some tilted. The overall effect is being watched from every direction.",
            "mood": "panoptic, intimate, claustrophobic -- the warmth of screens against the cold logic of surveillance",
            "bw_treatment": "High contrast. The screens glow white/gray against deep black backgrounds. The camera indicators are the only elements that could read as warm (red recording lights). The overall palette is the blue-white of screen luminescence rendered in grayscale.",
            "scale": "full_bleed"
          },
          "density": "dense",
          "tone": "dark",
          "svg_wireframe": "",
          "rationale": "The original spread 034 was a full-bleed abstract pattern (vertical stripes) -- textless, immersive, filling both pages. The contemporary version preserves the full-bleed immersion but replaces abstraction with confrontation: the screens are the new stripes, the new bars, the new pattern. The reader is inside the pattern, being watched by it. The single sentence floating in reversed type is the book's voice emerging from the surveillance field -- not commentary from outside but a label from within."
        }
      ],
      "selected_text": null,
      "selected_design": null,
      "reviewer_notes": null,
      "dependency_flags": ["spread_033", "spread_035"]
    },

    {
      "spread_id": "spread_035",
      "movement": "movement_1_environment",
      "theme": "The filter bubble as cell: Movement 1 closes",
      "text_options": [
        {
          "option_id": "a",
          "label": "The walls close in",
          "display_text": "A cell for scrollers to scroll in.",
          "body_text": "YouTube's recommendation algorithm drives 70% of all watch time. TikTok's For You page is 95% algorithmically curated. Google Search results diverge so profoundly by user profile that no two people inhabit the same informational environment.\n\nThe filter bubble is not a metaphor. It is architecture. The infrastructure you have just been shown -- every layer, every cable, every server, every address -- terminates here, in a room built to the exact dimensions of your data profile.\n\nThe cell is luminous. The bars are personalized. The door was never locked because you were never looking for it.\n\nCan you see the walls?",
          "caption_text": null,
          "quotations_used": [],
          "voice_register": "confrontational",
          "rhetorical_strategy": "confrontation",
          "rationale": "The display text transforms Joyce's 'A cell for citters to cit in' (which the original quoted) into a contemporary equivalent -- scrollers replacing citters, the prison updated to the feed. The body text moves through three registers: statistical (YouTube, TikTok, Google), architectural (the infrastructure terminates HERE), and intimate (the cell is luminous, the bars personalized). The final question -- 'Can you see the walls?' -- breaks the analytical fourth wall for the first time since the Prologue's direct address. M1 closes by confronting the reader with their enclosure inside everything that has been described. The book stops explaining and starts accusing.",
          "word_count": 130
        },
        {
          "option_id": "b",
          "label": "Noble's unequal cells",
          "display_text": "A cell for scrollers to scroll in.",